{
  "$schema": "https://json-schema.org/draft/2020-12/schema",
  "type": "object",
  "properties": {
    "schema_version": {
      "type": "string",
      "const": "1.0"
    },
    "snapshot_id": {
      "type": "string",
      "minLength": 1
    },
    "source_id": {
      "type": "string",
      "minLength": 1
    },
    "capability": {
      "type": "string",
      "enum": [
        "calendar.read",
        "tasks.read",
        "mail.read",
        "notes.read",
        "signals.read",
        "notification.send",
        "schedule.create",
        "local.tasks.write"
      ]
    },
    "captured_at": {
      "type": "string",
      "format": "date-time",
      "pattern": "^(?:(?:\\d\\d[2468][048]|\\d\\d[13579][26]|\\d\\d0[48]|[02468][048]00|[13579][26]00)-02-29|\\d{4}-(?:(?:0[13578]|1[02])-(?:0[1-9]|[12]\\d|3[01])|(?:0[469]|11)-(?:0[1-9]|[12]\\d|30)|(?:02)-(?:0[1-9]|1\\d|2[0-8])))T(?:(?:[01]\\d|2[0-3]):[0-5]\\d(?::[0-5]\\d(?:\\.\\d+)?)?(?:Z|([+-](?:[01]\\d|2[0-3]):[0-5]\\d)))$"
    },
    "timezone": {
      "type": "string",
      "minLength": 1
    },
    "status": {
      "type": "string",
      "enum": [
        "ok",
        "not_connected",
        "login_required",
        "read_failed",
        "stale",
        "not_read"
      ]
    },
    "expires_at": {
      "type": "string",
      "format": "date-time",
      "pattern": "^(?:(?:\\d\\d[2468][048]|\\d\\d[13579][26]|\\d\\d0[48]|[02468][048]00|[13579][26]00)-02-29|\\d{4}-(?:(?:0[13578]|1[02])-(?:0[1-9]|[12]\\d|3[01])|(?:0[469]|11)-(?:0[1-9]|[12]\\d|30)|(?:02)-(?:0[1-9]|1\\d|2[0-8])))T(?:(?:[01]\\d|2[0-3]):[0-5]\\d(?::[0-5]\\d(?:\\.\\d+)?)?(?:Z|([+-](?:[01]\\d|2[0-3]):[0-5]\\d)))$"
    },
    "failure_reason": {
      "type": "string",
      "maxLength": 1000
    },
    "recovery_hint": {
      "type": "string",
      "maxLength": 1000
    },
    "items": {
      "default": [],
      "type": "array",
      "items": {
        "type": "object",
        "properties": {
          "candidate_id": {
            "type": "string",
            "minLength": 1
          },
          "kind": {
            "type": "string",
            "enum": [
              "event",
              "task",
              "mail",
              "signal"
            ]
          },
          "title": {
            "type": "string",
            "minLength": 1,
            "maxLength": 300
          },
          "source_id": {
            "type": "string",
            "minLength": 1
          },
          "source_ref": {
            "type": "string"
          },
          "external_id": {
            "type": "string"
          },
          "url": {
            "type": "string",
            "format": "uri"
          },
          "start_at": {
            "type": "string",
            "format": "date-time",
            "pattern": "^(?:(?:\\d\\d[2468][048]|\\d\\d[13579][26]|\\d\\d0[48]|[02468][048]00|[13579][26]00)-02-29|\\d{4}-(?:(?:0[13578]|1[02])-(?:0[1-9]|[12]\\d|3[01])|(?:0[469]|11)-(?:0[1-9]|[12]\\d|30)|(?:02)-(?:0[1-9]|1\\d|2[0-8])))T(?:(?:[01]\\d|2[0-3]):[0-5]\\d(?::[0-5]\\d(?:\\.\\d+)?)?(?:Z|([+-](?:[01]\\d|2[0-3]):[0-5]\\d)))$"
          },
          "end_at": {
            "type": "string",
            "format": "date-time",
            "pattern": "^(?:(?:\\d\\d[2468][048]|\\d\\d[13579][26]|\\d\\d0[48]|[02468][048]00|[13579][26]00)-02-29|\\d{4}-(?:(?:0[13578]|1[02])-(?:0[1-9]|[12]\\d|3[01])|(?:0[469]|11)-(?:0[1-9]|[12]\\d|30)|(?:02)-(?:0[1-9]|1\\d|2[0-8])))T(?:(?:[01]\\d|2[0-3]):[0-5]\\d(?::[0-5]\\d(?:\\.\\d+)?)?(?:Z|([+-](?:[01]\\d|2[0-3]):[0-5]\\d)))$"
          },
          "due_at": {
            "type": "string",
            "format": "date-time",
            "pattern": "^(?:(?:\\d\\d[2468][048]|\\d\\d[13579][26]|\\d\\d0[48]|[02468][048]00|[13579][26]00)-02-29|\\d{4}-(?:(?:0[13578]|1[02])-(?:0[1-9]|[12]\\d|3[01])|(?:0[469]|11)-(?:0[1-9]|[12]\\d|30)|(?:02)-(?:0[1-9]|1\\d|2[0-8])))T(?:(?:[01]\\d|2[0-3]):[0-5]\\d(?::[0-5]\\d(?:\\.\\d+)?)?(?:Z|([+-](?:[01]\\d|2[0-3]):[0-5]\\d)))$"
          },
          "plan_date": {
            "type": "string",
            "format": "date",
            "pattern": "^(?:(?:\\d\\d[2468][048]|\\d\\d[13579][26]|\\d\\d0[48]|[02468][048]00|[13579][26]00)-02-29|\\d{4}-(?:(?:0[13578]|1[02])-(?:0[1-9]|[12]\\d|3[01])|(?:0[469]|11)-(?:0[1-9]|[12]\\d|30)|(?:02)-(?:0[1-9]|1\\d|2[0-8])))$"
          },
          "actor": {
            "default": "self",
            "type": "string",
            "enum": [
              "self",
              "other",
              "unknown"
            ]
          },
          "estimate_minutes": {
            "type": "integer",
            "minimum": 5,
            "maximum": 720
          },
          "next_action": {
            "type": "string",
            "maxLength": 500
          },
          "risk": {
            "type": "string",
            "maxLength": 500
          },
          "project_id": {
            "type": "string"
          },
          "status": {
            "type": "string",
            "enum": [
              "inbox",
              "next",
              "waiting",
              "someday",
              "done",
              "canceled"
            ]
          },
          "priority": {
            "default": "p2",
            "type": "string",
            "enum": [
              "p0",
              "p1",
              "p2",
              "p3"
            ]
          },
          "all_day": {
            "default": false,
            "type": "boolean"
          },
          "notes": {
            "type": "string",
            "maxLength": 5000
          }
        },
        "required": [
          "candidate_id",
          "kind",
          "title",
          "source_id",
          "actor",
          "priority",
          "all_day"
        ],
        "additionalProperties": false
      }
    }
  },
  "required": [
    "schema_version",
    "snapshot_id",
    "source_id",
    "capability",
    "captured_at",
    "timezone",
    "status",
    "items"
  ],
  "additionalProperties": false,
  "$id": "https://schemas.banpie.info/daily-chief/v1/SourceSnapshot.schema.json"
}
